{
  "version": "v37",
  "snapshot_id": "live",
  "snapshot_path": "",
  "run_at": "2026-04-14T10:44:16.649918+00:00",
  "seed": 42,
  "features": "",
  "n_cycles": 200,
  "metrics": {
    "pnl": -28.8,
    "win_rate": 0.1538,
    "profit_factor": 0.7355,
    "n_trades": 39,
    "long_pct": 0.0,
    "short_pct": 1.0,
    "max_drawdown": -89.52,
    "sharpe": -0.558,
    "regime_pnl": {
      "normal": -0.01,
      "crisis": -51.87,
      "high_vol": 23.07
    },
    "disposition_coefficient": null,
    "hold_ratio": 1.259,
    "avg_mae": null,
    "avg_mfe": null,
    "_n_win_captures": 0,
    "_n_loss_captures": 0
  },
  "gate_result": {
    "passed": false,
    "gates": {
      "pnl_positive": false,
      "profit_factor_above_1": false,
      "n_trades_sufficient": true,
      "long_short_balanced": false,
      "no_regime_catastrophe": true,
      "disposition_acceptable": true
    },
    "failure_reasons": [
      "PnL negative: $-28.80",
      "PF < 1: 0.736",
      "L/S imbalance: 0% long"
    ]
  },
  "leaderboard_rank": null
}